{
  "$schema": "http://json-schema.org/draft-07/schema#",
  "description": "Common schema for all Resilio knowledge JSON files",
  "type": "object",
  "required": ["schema_version", "target_agent", "language", "last_updated", "extracted_rules"],
  "additionalProperties": true,
  "properties": {
    "schema_version": { "type": "string", "const": "1.0" },
    "target_agent": {
      "type": "string",
      "enum": ["Head Coach", "Running Coach", "Lifting Coach", "Swimming Coach", "Biking Coach", "Nutrition Coach", "Recovery Coach"]
    },
    "language": { "type": "string", "enum": ["en"] },
    "last_updated": { "type": "string", "pattern": "^\\d{4}-\\d{2}-\\d{2}$" },
    "source_books": { "type": "array", "items": { "type": "string" } },
    "extracted_rules": {
      "type": "array",
      "minItems": 1,
      "items": {
        "type": "object",
        "required": ["rule_name", "category", "condition", "action", "formula_or_value", "priority", "confidence", "source", "applies_to"],
        "properties": {
          "rule_name":        { "type": "string", "minLength": 1 },
          "category":         { "type": "string", "minLength": 1 },
          "condition":        { "type": "string", "minLength": 1 },
          "action":           { "type": "string", "minLength": 1 },
          "formula_or_value": { "type": "string", "minLength": 1, "not": { "const": "N/A" } },
          "priority":         { "type": "string", "enum": ["high", "medium", "low"] },
          "confidence":       { "type": "string", "enum": ["strong", "moderate", "weak"] },
          "source":           { "type": "string", "minLength": 1 },
          "applies_to":       { "type": "array", "minItems": 1, "items": { "type": "string" } }
        }
      }
    }
  }
}
